927,AVPFPK8KLJEJML43BCUD,B01BH83OOM,0.0,5.0,"amazon tap perfect complement amazon echo. put office space...has advantage echo also great bluetooth speaker. ""tap"" mic button summon alexa issue all! sound quality good bluetooth speaker market extremely portable.",Great Purchase,BobbyG,215,1
928,AVPFPK8KLJEJML43BCUD,B01BH83OOM,0.0,5.0,alexa work great lot thing you. fun family.,Great product!,Lanette,43,1
929,AVPFPK8KLJEJML43BCUD,B01BH83OOM,0.0,5.0,"i'm glad bought product, easy understand, grandkids love it.",Alexa is very helpful,Littledavila,60,1
930,AVPFPK8KLJEJML43BCUD,B01BH83OOM,0.0,4.0,"besides missing app functionality (check compatibility purchasing), exactly want to.","Some unpleasant quirks, but overall very good",Alexgsp,84,1
931,AVPFPK8KLJEJML43BCUD,B01BH83OOM,0.0,4.0,mostly use speaker. still waiting touch feature adding.,Cool little gadget,Outofcrayons,55,1
932,AVPFPK8KLJEJML43BCUD,B01BH83OOM,0.0,4.0,"friend gave dot, enjoyed. decided explore devices. torn echo tap. reading cnet review, chose tap portable. two frustration cannot change wake word ""alexis"", exact language requesting service. amazon prime audible book member, great addition household.",Great device,JeffM,251,1
933,AVPFPK8KLJEJML43BCUD,B01BH83OOM,0.0,5.0,"guys, tap everything echo portable! use home everything, work desk music, weather, etc, even poolside portable speaker.",Great for home and travel,funfam3,119,1
934,AVPFPK8KLJEJML43BCUD,B01BH83OOM,0.0,4.0,great sound. love it. value well worth it.,Well worth it,Good,42,1
935,AVPFPK8KLJEJML43BCUD,B01BH83OOM,0.0,5.0,best worlds. reasonably priced bt speaker amazon alexa enabled device. would highly recommend anyone looking bt speaker considering alexa enabled device.,Great product!,clc4912,153,1
936,AVPFPK8KLJEJML43BCUD,B01BH83OOM,2.0,5.0,"use hour day. whether listening spotify turning wemo-device, battery life, sound quality, voice recognition great.",Love it,NTKramer,114,1
937,AVPFPK8KLJEJML43BCUD,B01BH83OOM,0.0,4.0,happy tap. echo would unplug plug use deck. tap take charging stand go. bothering bluetooth speaker using phone play music ever internet tap.,Small Echo that you can take outside,DK10,141,1
938,AVPFPK8KLJEJML43BCUD,B01BH83OOM,0.0,5.0,good sound. battery last long connects easily wifi blue tooth. touch button speak it.,Its loud and has a good battery,Edelenjacob,85,1
939,AVPFPK8KLJEJML43BCUD,B01BH83OOM,0.0,5.0,"great on-the-go speaker. like fact sits charging cradle instead plug in. also, bonus: alex. like update done well push button activate her, say name. looking echo decent speaker without paying much, choose one. spend more,m get regular echo better booming sound, can't travel it.",Great on the go speaker,SuperNintendoChalmers,279,1
940,AVPFPK8KLJEJML43BCUD,B01BH83OOM,0.0,4.0,we're early stage home smartness good start,Solid,denny,43,1
941,AVPFPK8KLJEJML43BCUD,B01BH83OOM,0.0,4.0,like product app slow esp. outside u.s. go.,Cool but its app didn't work well,BKKTH,43,1
942,AVPFPK8KLJEJML43BCUD,B01BH83OOM,0.0,5.0,bought blue tooth speaker ipod touch. charged turned etc. tell alexa play music.,Alexa House,IceisMN612,80,1
943,AVPFPK8KLJEJML43BCUD,B01BH83OOM,0.0,5.0,"love it, work better anticipated. also good price",Great device,Jusandy25,49,1
944,AVPFPK8KLJEJML43BCUD,B01BH83OOM,0.0,5.0,"already alexa one great addition. portable, rechargeable good sound.",Great product,Sevirj89,68,1
945,AVPFPK8KLJEJML43BCUD,B01BH83OOM,0.0,4.0,nice big echo. know tap available buy.,Amazon Tap,bill,38,1
946,AVPFPK8KLJEJML43BCUD,B01BH83OOM,0.0,1.0,good bluetooth speaker sound quality good otherwise pretty useless come get answering question,Good Bluetooth speaker,Jeepster,94,0
947,AVPFPK8KLJEJML43BCUD,B01BH83OOM,0.0,5.0,one get amazon's update device always on. also best speaker three.,Best speaker of the three,John,66,1
948,AVPFPK8KLJEJML43BCUD,B01BH83OOM,0.0,3.0,"product ok, impressed commercial defiantly interesting",Ok product,Blaze,54,0
949,AVPFPK8KLJEJML43BCUD,B01BH83OOM,0.0,5.0,cute speaker. bit expensive amazon streaming capability make worth,Alexa + Bluetooth= Gold,Mom2Kingston,66,1
950,AVPFPK8KLJEJML43BCUD,B01BH83OOM,0.0,5.0,"great product. also dot ability take anywhere huge bonus, hand free mode work like dot, sound great. use tap time; working projects, making shopping lists, playing games, turning lights. looked echo even battery pack seem mobile.",Great Product,Venti,229,1
951,AVPFPK8KLJEJML43BCUD,B01BH83OOM,0.0,4.0,alexa wanted speaker traveling. use without plug cord.,So much fun for traveling,Collygirl,54,1
952,AVPFPK8KLJEJML43BCUD,B01BH83OOM,0.0,5.0,"nice complement alexa family. sound quality nearly good original echo, voice activation addition make even better by, particularly price.",Another win for Amazon,Bertram,137,1
953,AVPFPK8KLJEJML43BCUD,B01BH83OOM,0.0,4.0,echo easy use fun use buy one want house.,The echo is great,Rocky,41,1
954,AVPFPK8KLJEJML43BCUD,B01BH83OOM,0.0,5.0,item exactly looking for. perfect size home travel. loud size.,Excellent,Missy,62,1
955,AVPFPK8KLJEJML43BCUD,B01BH83OOM,0.0,5.0,make great alarm reminder device. 2 dot tap. use all.,Great product,robo,53,1
956,AVPFPK8KLJEJML43BCUD,B01BH83OOM,0.0,4.0,great bluetooth speaker added benefit alexa,Great Blutooth Speaker,MikeG,43,1
957,AVPFPK8KLJEJML43BCUD,B01BH83OOM,0.0,5.0,love able use alexa unplugged. amazing device!,Amazing,dwd3885,46,1
958,AVPFPK8KLJEJML43BCUD,B01BH83OOM,0.0,4.0,advertise. good bedroom plug external speakers.,Does what it says it does,Karl,47,1
959,AVPFPK8KLJEJML43BCUD,B01BH83OOM,0.0,5.0,help kid question play music like .,Great for entire family,Kenny,35,1
960,AVPFPK8KLJEJML43BCUD,B01BH83OOM,0.0,5.0,great sound quality small item. easy hide noticeable.,Great sound from small speaker,Player99,53,1
961,AVPFPK8KLJEJML43BCUD,B01BH83OOM,0.0,5.0,price amazon amazing. like echo smaller. show everyone great is.,Great product,Jpsdrivesfast,64,1
962,AVPFPK8KLJEJML43BCUD,B01BH83OOM,0.0,5.0,quality product clear crisp sound. best part carried satchel. sound loud enough back yard gathering.,Awesome speaker,Rabah,100,1
963,AVPFPK8KLJEJML43BCUD,B01BH83OOM,0.0,5.0,definitely enjoy using home. surprised intuitive able answer question seconds. mostly use play music amazon player. know there's ton can't wait take advantage capabilities.,Fun addition to your home,CPLPUN,172,1
964,AVPFPK8KLJEJML43BCUD,B01BH83OOM,0.0,5.0,first boughy alezxa amazon found voice recognition search algorithm lacking,Great. I returned Alexxa and love it,Vstorageerich,75,1
965,AVPFPK8KLJEJML43BCUD,B01BH83OOM,0.0,5.0,love speaker work wonderfully. recommend,Great,Beke,40,1
966,AVPFPK8KLJEJML43BCUD,B01BH83OOM,0.0,5.0,work like echo portable!! great stuff. described!,Great product,Philme,49,1
967,AVPFPK8KLJEJML43BCUD,B01BH83OOM,0.0,4.0,amazon tap one best buy year far...the thing could make tap better upgrade tap every command....that would make 5star device....,A must have.....,Chris201,128,1
968,AVPFPK8KLJEJML43BCUD,B01BH83OOM,0.0,4.0,love product. great sound quality good price,amazon tap,Jenn,44,1
969,AVPFPK8KLJEJML43BCUD,B01BH83OOM,0.0,5.0,"amazon tap (which purchased best buy month ago) love much bought one son family. love it, too!",Great Product!,1215,94,1
970,AVPFPK8KLJEJML43BCUD,B01BH83OOM,0.0,5.0,"wanted speaker listen pandora go much more! able speak alexa get news, weather, timer, light control much more! love product!",Great addition to home devices,Pick,125,1
971,AVPFPK8KLJEJML43BCUD,B01BH83OOM,0.0,5.0,awesome use work lot loud enough enjoy,It awesome,Davesmith82,38,1
972,AVPFPK8KLJEJML43BCUD,B01BH83OOM,0.0,5.0,love alexa. currently three device use daily basis. use one work basically streaming music. great device. problem connecting them.,Love Alexa,MikeNof,130,1
973,AVPFPK8KLJEJML43BCUD,B01BH83OOM,0.0,5.0,"smart, timely, effective around house. dot well tap much better sound. google earth replaced tap google smart tappy!",Met all my expectations,Hunter,116,1
974,AVPFPK8KLJEJML43BCUD,B01BH83OOM,0.0,5.0,"easy connect devices, produce good sound. i'm pleased purchase.",User Friendly,Saulny,63,1
975,AVPFPK8KLJEJML43BCUD,B01BH83OOM,0.0,4.0,"already amazon echo, smart speaker, one handy device there. many thing find list keep growing. since software update allows use ""always on"" voice command like big brother, become go device.pros:- wireless bluetooth smart speaker - take work use car, even travel work- sync's popular music aps (spotify, pandora, etc)- alexa responsive answer question quickly- best alarm clock- sync audio book use long car ride business trips- speaker able get loud- control smart device like lighting ecobee - option turn off/on voice commands, use tap button instead- long range voice commandscons:- single band wi-fi 2.4ghz- battery life using ""always on"" voice command short- speaker quality sub par music compared bluetooth speakersoverall usefulness device near perfect needs, minimal cons. use device pretty much every day small enough make excellent travel companion.tip bestbuy: carry case device get protector elsewhere",Great Device Made better with Sofware Update,RVCOS,913,1
976,AVPFPK8KLJEJML43BCUD,B01BH83OOM,0.0,5.0,"like flexibility, portability best value option three alexas",The Tab is awesome,SamMan,60,1
977,AVPFPK8KLJEJML43BCUD,B01BH83OOM,0.0,5.0,thank you. great product ages. thank you!!,Great,WKKA,42,1
978,AVPFPK8KLJEJML43BCUD,B01BH83OOM,0.0,5.0,got son xmas. love it. us daily.,My sons xmas gift,Maria,32,1
979,AVPFPK8KLJEJML43BCUD,B01BH83OOM,0.0,4.0,"..exactly wanted, battery drain fast hand free mode.",Nice but...,wax0pal,52,1
980,AVPFPK8KLJEJML43BCUD,B01BH83OOM,0.0,5.0,amazon tap awesome! take alexa outside! sound quality amazing price right!,To much Fun,Robbie,74,1
981,AVPFPK8KLJEJML43BCUD,B01BH83OOM,0.0,5.0,wife us tap mostly listen music. love fact take room house. turn sound hear i'm different part house.,Wife loves the TAP.,Tapmethis,101,1
982,AVPFPK8KLJEJML43BCUD,B01BH83OOM,0.0,5.0,"little speaker way better mother. update making hand free, recommend anyone.",ALEXA is the best,ricanaustin,76,1
983,AVPFPK8KLJEJML43BCUD,B01BH83OOM,0.0,5.0,great addition home office. alexa upstairs.,Tap,Tttt,43,1
984,AVPFPK8KLJEJML43BCUD,B01BH83OOM,0.0,4.0,"echo sound better music, tap give portability. good both. tap voice activated, good.",Not bad.,Mike,84,1
985,AVPFPK8KLJEJML43BCUD,B01BH83OOM,0.0,5.0,even speaker alone item worth price!,Awesome Quality Speaker,JPS71,36,1
986,AVPFPK8KLJEJML43BCUD,B01BH83OOM,0.0,4.0,"alexa {speaking amazon tap) great around ! current news, personal planning detail well detail might forgotten available alexa..... tap sits next bed nite stand easily call ijnfo bed walk day nite. especially useful review calendar review upcoming day plans. try alexa store guess want house!",Useful info and fun to have around,Rich,291,1
987,AVPFPK8KLJEJML43BCUD,B01BH83OOM,0.0,5.0,"bought echo tap, echo dot, phillips hue starter kit honeywell thermostat wife birthday.she love i!cant wait add automated product it. need phone fumbling multiple apps change lighting temperature, check weather, play music, etc., ask alexa continue i'm doing.also, dot tap room, one closest typically answer requests. nice device improve time.",We love this lil thing!!!,Pete,343,1
988,AVPFPK8KLJEJML43BCUD,B01BH83OOM,0.0,5.0,i'm amazed sound quality little speaker unit set easy recommend,Great sound,Paul,63,1
989,AVPFPK8KLJEJML43BCUD,B01BH83OOM,0.0,4.0,ask alexa almost anything kid love play music,great product for price,doclee,45,1
990,AVPFPK8KLJEJML43BCUD,B01BH83OOM,0.0,5.0,love portable move room room effortlessly.,Great addition to the Echo,paul,42,1
991,AVPFPK8KLJEJML43BCUD,B01BH83OOM,0.0,5.0,"great item, good service best buy. uncanny new unique product introduced often.",Amazing,Sassy,79,1
992,AVPFPK8KLJEJML43BCUD,B01BH83OOM,0.0,5.0,bought christmas gift sound amazing. course integration wonderful too.,Excellent sound,GPJR,70,1
993,AVPFPK8KLJEJML43BCUD,B01BH83OOM,0.0,3.0,great device use regular basis. good investment,Great product,bob2531,47,0
994,AVPFPK8KLJEJML43BCUD,B01BH83OOM,0.0,4.0,figured yet. far seems ok used potential yet.,Unsure,Cheryl,45,1
995,AVPFPK8KLJEJML43BCUD,B01BH83OOM,0.0,4.0,"overall sound good echo, primary source amazon content. however, tap great medium volume music radio station alarm clock. portability set apart, however, nice able take room room garage patio without disconnecting. recent software update allows listening mode. require brief pause saying alexa wake word, work. drain battery quickly keep charger base toggle listening mode touch button. portability voice activation make worthwhile addition echo, fabulous!",Good companion to Echo,Mike,456,1
996,AVPFPK8KLJEJML43BCUD,B01BH83OOM,0.0,3.0,"much better echo dot. however, fact touch button activate instead talking bit annoying. speaker fairly powerful size.",Voice command only would be nice.,Savageks,117,0
997,AVPFPK8KLJEJML43BCUD,B01BH83OOM,0.0,3.0,"product work well. however, hold button use best part device, alexa. really wanted take back little annoying hold button every time question sound quality product dog awesome!!",OK,marie,176,0
998,AVPFPK8KLJEJML43BCUD,B01BH83OOM,0.0,5.0,amazon tap great sound responsive request song music like. rechargeable battery portable great taking music move around. thumb tap!,Great Sound,mrmystery,131,1
999,AVPFPK8KLJEJML43BCUD,B01BH83OOM,0.0,5.0,easy set up. excellent sound quality price,Great for easy set up,Np71,42,1
1000,AVPFPK8KLJEJML43BCUD,B01BH83OOM,0.0,5.0,product awesome. play favorite music instantly. also great fun asking alexa questions. serious funny. love it!!,So much fun!,Happy,111,1
1001,AVPFPK8KLJEJML43BCUD,B01BH83OOM,0.0,5.0,great speaker echo substitute. great go bluetooth speaker connected internet work great using alexa app.,Great speaker,Alky,104,1
1002,AVPFPK8KLJEJML43BCUD,B01BH83OOM,0.0,5.0,sound par high end portable speakers. however really tip iceberg. amazon prime access music asking. also work phillips hue turn light voice.,excellent product,MaverickSmooth,140,1
1003,AVPFPK8KLJEJML43BCUD,B01BH83OOM,0.0,4.0,would recommend prouducts great full sound full sound conpack,Enjoy my amazion blue tooth speaker Great sound,MrGGarry,61,1
1004,AVPFPK8KLJEJML43BCUD,B01BH83OOM,0.0,5.0,work really well echo really neat fun,Awesome,fatpants,37,1
1005,AVPFPK8KLJEJML43BCUD,B01BH83OOM,0.0,4.0,amazon tap awesome! happy purchase!,Great Speaker,BABYDURR,35,1
1006,AVPFPK8KLJEJML43BCUD,B01BH83OOM,0.0,2.0,"i'm thinking must fluke, never worked. return item received full refund",It never worked,momof2,71,0
1007,AVPFPK8KLJEJML43BCUD,B01BH83OOM,0.0,5.0,sound great. must touch activate. easy use.,Great Speaker Quality,Steve,43,1
1008,AVPFPK8KLJEJML43BCUD,B01BH83OOM,0.0,4.0,"amazon tap first step making home smart home. act brain everything else. unfortunately, invest quite bit smart lights, thermostat, locks, etc. get full potential it. alone, merely act bluetooth speaker extension phone.",Great start to a smart home,notoriouspip,218,1
1009,AVPFPK8KLJEJML43BCUD,B01BH83OOM,0.0,4.0,"would get another, work great, fun option",great,betty883,41,1
1010,AVPFPK8KLJEJML43BCUD,B01BH83OOM,0.0,5.0,"unlike larger version, need plugged in..making portable....although press button every request..it's great take ever go..fully rechargable",Great tool for quick information,RUGE777,138,1
1011,AVPFPK8KLJEJML43BCUD,B01BH83OOM,0.0,5.0,"amazon tap put impressive amount sound small device. thing note familiar tap seen person:- roughly size glass water- default, press microphone button talk alexa, update released feb 17th, 2017 option alexa app make tap always listen without pushing button (at expense battery life)- speaker grille metal, though look like pictures. mesh fabric, similar feel end speaker grille micrphones. firm comfortable hold, push hard enough flex. - using sling case likely allow use charging dock, little room tap dock kind case.- charge tap using either included dock plugging micro usb cable (one included) back speaker.",Excellent Sound in a Small Package,TuxToaster,610,1
1012,AVPFPK8KLJEJML43BCUD,B01BH83OOM,0.0,5.0,"hi everyone, alexa best best. feel like know week. strong speaker love music. know like everything ever. ask crazy fact always responds something. struggle little recent events. get better time. home personal assistant assist managing calendar. word. awesome!",I Love Alexa,chris,259,1
1013,AVPFPK8KLJEJML43BCUD,B01BH83OOM,0.0,5.0,luke lot good good,Great,Dave,18,1
1014,AVPFPK8KLJEJML43BCUD,B01BH83OOM,0.0,5.0,great sound. portable. kid love it. think would use tend use lot.,Love it,JohnA,65,1
1015,AVPFPK8KLJEJML43BCUD,B01BH83OOM,0.0,4.0,would go echo talk it. tap touch talk it. speaker good though size.,Good sound but you have to tap it,beezth,67,1
1016,AVPFPK8KLJEJML43BCUD,B01BH83OOM,0.0,4.0,good loud sound. good speaker. convenient voice command take outside house.,Easy setup,Nasa,75,1
1017,AVPFPK8KLJEJML43BCUD,B01BH83OOM,0.0,5.0,"bought mother law use outside gardening. huuuge portable speaker sound good used many double 'd' batteries. one sound better last day. concerned able figure out, user friendly issue it. love good thing.",Mother-In-Law Christmas gift success,BNBFan,202,1
1018,AVPFPK8KLJEJML43BCUD,B01BH83OOM,0.0,5.0,great speaker sound ease setup. work great amazon music option.,Great sound - ease of setup and use,Steve,63,1
1019,AVPFPK8KLJEJML43BCUD,B01BH83OOM,0.0,4.0,gift fot daughter. seems enjoy much.,gift,cantuc,36,1
1020,AVPFPK8KLJEJML43BCUD,B01BH83OOM,0.0,5.0,son requested birthday gift. enjoying everyday.,Fun product,bossfan,47,1
1021,AVPFPK8KLJEJML43BCUD,B01BH83OOM,0.0,4.0,"good, overall capable comprehensive hoping. continue explore capability apps.",Good,MacG,77,1
1022,AVPFPK8KLJEJML43BCUD,B01BH83OOM,0.0,4.0,"great personal speaker. tap echo. downside tap actually physically ""tap"" mic button activate alexa. sound quality pretty good price. afford it, would upgrade echo.",Great Speaker,fvsucat,163,1
1023,AVPFPK8KLJEJML43BCUD,B01BH83OOM,0.0,4.0,able train alexa like we've heard. probably fault. fun it.,We like it,Alexa,58,1
1024,AVPFPK8KLJEJML43BCUD,B01BH83OOM,0.0,5.0,bought couple friend big hit them! useful!,A Gift!,RugbyRef,42,1
1025,AVPFPK8KLJEJML43BCUD,B01BH83OOM,0.0,5.0,"best portable speaker i've ever owned. use everyday, mostly getting ready morning guest over. good sound quality link alexa app like echo. come charging base allows plugged unlike echo. also connects mobile device via bluetooth aux cord.",Amazon Tap,cc2wclc,237,1
1026,AVPFPK8KLJEJML43BCUD,B01BH83OOM,0.0,4.0,easy setup use. still learning maximize usage. instructio simple cover much using alexa .,Very good bluetooth speaker,Mike,89,1
1027,AVPFPK8KLJEJML43BCUD,B01BH83OOM,0.0,3.0,work great reason always answer answer turn tv make sure one else talking still work time. easy set phone app. seem matter phone working. i've tried close far between. case great work pit,When it works I love it,Rickyvic,187,0
1028,AVPFPK8KLJEJML43BCUD,B01BH83OOM,0.0,4.0,unexpected gift. like alexa one portable. great streaming music. kid use time. problem far always understand i'm saying. especially saying name radio station. sometimes take try get i'm looking for. great sound playing music. talk radio good understandable. want portable speaker alexa one get.,Great gadget,Muzz2160,294,1
1029,AVPFPK8KLJEJML43BCUD,B01BH83OOM,0.0,3.0,need amazon prime plus order special music plan. disappointing sure. sound ok. think larger model probably better.,Not what I thought,Justme,114,0
1030,AVPFPK8KLJEJML43BCUD,B01BH83OOM,0.0,5.0,"love tap! bought gift love sound quality. small speaker, pack big punch!",Nicely Done,Nunyun345,72,1
1031,AVPFPK8KLJEJML43BCUD,B01BH83OOM,0.0,5.0,alexa super form info little wait time.,great source of info,cheeserat,39,1
1032,AVPFPK8KLJEJML43BCUD,B01BH83OOM,0.0,5.0,love everything want can't believe great,Great Amazon tap,Alan,40,1
1033,AVPFPK8KLJEJML43BCUD,B01BH83OOM,0.0,3.0,"product, speaker great, fails deliver voice interface. use cell phone computer buy echo dot.",Tap - Fills a Gap That Didn't Need Filling,Nick,92,0
1034,AVPFPK8KLJEJML43BCUD,B01BH83OOM,0.0,4.0,enjoying tap much. lot's play app. still finding new thing daily. great sound quality play music. wish better search engine.,Great sound and fun,minded,124,1
1035,AVPFPK8KLJEJML43BCUD,B01BH83OOM,0.0,4.0,got family love it. great gift,Very good and fun,DaveGS,30,1
1036,AVPFPK8KLJEJML43BCUD,B01BH83OOM,0.0,5.0,sleep design work great. ideal gift person everything.,Great product,Kathy4901,54,1
1037,AVPFPK8KLJEJML43BCUD,B01BH83OOM,0.0,4.0,"excellent gift family, good choice.",Great Gift,oldschool,35,1
1038,AVPFPK8KLJEJML43BCUD,B01BH83OOM,0.0,5.0,"great product great price best buy. press button rather saying name, that's price pay cordless.",I choose Alexa over Siri any day,JustMe,95,1
1039,AVPFPK8KLJEJML43BCUD,B01BH83OOM,0.0,2.0,"fun would buy again. informative. keep say ""i understand question. """,A little fun but not very useful,tinkerbell2,68,0
1040,AVPFPK8KLJEJML43BCUD,B01BH83OOM,0.0,5.0,"bought gift, love it. entertaining wonderful volume, lot fun it.",Lots of fun,Shaneab,64,1
1041,AVPFPK8KLJEJML43BCUD,B01BH83OOM,0.0,5.0,"surprised great work , music ask question awesome",AWESOME,cOBRA,49,1
1042,AVPFPK8KLJEJML43BCUD,B01BH83OOM,0.0,5.0,awesome product. enjoy using everyday. would definitely recommend,Awesome,Gizzard,65,1
1043,AVPFPK8KLJEJML43BCUD,B01BH83OOM,0.0,4.0,enjoy it. gray reading working out.,Excellent,ShayEric,35,1
1044,AVPFPK8KLJEJML43BCUD,B01BH83OOM,0.0,5.0,absolutely love amazon echo. convenient handy.,Alexa,Bamafever78,46,1
1045,AVPFPK8KLJEJML43BCUD,B01BH83OOM,0.0,5.0,gift wife listen music sewing plus able purchase supply run out.,My wife loves it!,Alan,64,1
1046,AVPFPK8KLJEJML43BCUD,B01BH83OOM,0.0,5.0,"overall little skeptical product wanted. turn out, amazing!",Great,Jpalmer00,59,1
1047,AVPFPK8KLJEJML43BCUD,B01BH83OOM,0.0,5.0,really enjoy interface integrate amazon music service .....great,Great device,GeorgeO,64,1
1048,AVPFPK8KLJEJML43BCUD,B01BH83OOM,0.0,5.0,added echo collection great go around house. like tap activate,Awesome,Tony,62,1
1049,AVPFPK8KLJEJML43BCUD,B01BH83OOM,0.0,5.0,bought gift girlfriend love it.,Perfect.,BigToe,31,1
1050,AVPFPK8KLJEJML43BCUD,B01BH83OOM,0.0,5.0,"absolutely love amazon tap. opinion best blue-tooth speaker around added skill wifi, tap better echo! portable - yes! sound quality - charts! blue-tooth computer listen movie great dolby sound quality. battery life tested camping trip. 8 hour kept charge! also easy recharge without stand. cool. best buy's price made best buy christmas season! picked item day local best buy. experience 1 - 2 - done. convenient, helpful. would recommend friends!!!",AMAZON TAP Best Portable Tech item of the Season!,Dcmurphy1515,449,1
1051,AVPFPK8KLJEJML43BCUD,B01BH83OOM,0.0,3.0,bought christmas gift. i'm told enjoying happy do.,Great gift idea,Ohellknow,50,0
1052,AVPFPK8KLJEJML43BCUD,B01BH83OOM,0.0,5.0,alexa work great. easy set-up us. wife us playing music iphone happy it. always finding learning new thing alexa.,Two thumbs up.,danmiller,113,1
1053,AVPFPK8KLJEJML43BCUD,B01BH83OOM,0.0,5.0,love portability! speaker phenomenal!,Love my echo,Janet,37,1
1054,AVPFPK8KLJEJML43BCUD,B01BH83OOM,0.0,4.0,"good product, speaker good, price right. liked everything it, fact press button time wanted talk it, unlike echo dot. portability good, much use portable. unless going keep tap within arm's reach, better one hand free voice activated products. recommended caveat",very good product,samboo,262,1
1055,AVPFPK8KLJEJML43BCUD,B01BH83OOM,0.0,4.0,love amazon tap. sound great completely portable. lack convenience touch free voice command cost le compensate. excellent product money!,Excellent sound quality,str4920,136,1
1056,AVPFPK8KLJEJML43BCUD,B01BH83OOM,0.0,5.0,"love tap, play daughter' music. work well amazon prime member.",Great product,jaxnvilleguy,62,1
1057,AVPFPK8KLJEJML43BCUD,B01BH83OOM,0.0,4.0,"super easy connect via bluetooth - great sound, fun use.",Great Gift,Dave3635,56,1
1058,AVPFPK8KLJEJML43BCUD,B01BH83OOM,0.0,5.0,work well take time know vocabulary,A great assistant,apple21man,35,1
1059,AVPFPK8KLJEJML43BCUD,B01BH83OOM,0.0,5.0,nice price gift idea time. small compact version alexa.,Great price,Bandit,55,1
1060,AVPFPK8KLJEJML43BCUD,B01BH83OOM,0.0,5.0,"tap wonderful! use timer, weather update general music. sound terrific. would recommend unit. certainly easy use - tap away.",Great sound!,marathonman,124,1
1061,AVPFPK8KLJEJML43BCUD,B01BH83OOM,0.0,5.0,serf need required. sound good. ability move device required ideal,Happy,Friend,66,1
1062,AVPFPK8KLJEJML43BCUD,B01BH83OOM,0.0,5.0,amazon tip leading technology. always great luck product.,I really enjoy Amazon Products,jimbo,57,1
1063,AVPFPK8KLJEJML43BCUD,B01BH83OOM,0.0,3.0,"speaker pretty loud love take downside hold ""home"" button use alexa",Good Bluetooth device,Breezy,67,0
1064,AVPFPK8KLJEJML43BCUD,B01BH83OOM,0.0,5.0,love alexa....it work well. speaker system excellent amazing many thing does!,Great sound!,Maryann,77,1
1065,AVPFPK8KLJEJML43BCUD,B01BH83OOM,0.0,5.0,take everywhere music wifi connected world. best battery last long time.,On the go,father,72,1
1066,AVPFPK8KLJEJML43BCUD,B01BH83OOM,0.0,5.0,great service loved item great gift,Great,Loretta,35,1
1067,AVPFPK8KLJEJML43BCUD,B01BH83OOM,0.0,5.0,"latest news flash, weather info, hearing joke cooking waiting alexa set timer, amazon tap fun tool around house!",Great fun for the family,Gdub61,112,1
1068,AVPFPK8KLJEJML43BCUD,B01BH83OOM,0.0,3.0,"want tap make use amazon's alexa voice services, dont get one. tap fine enough bluetooth speaker wireless music, need touch button voice service render far le valuable.",Ok for what it is,Gerald,168,0
1069,AVPFPK8KLJEJML43BCUD,B01BH83OOM,0.0,5.0,great sound functionality. minimal kink programming. love bedroom.,Awesome for college students,Supahfree,66,1
