264,AV1T19MDGV-KLJ3ADSMT,B010EK1GOE,29.0,5.0,"note: original kindle oasis review posted 4/29/16 product page amazon: new - kindle oasis e-reader leather charging cover. page product purchaser wish use outside u.s. original review follows.update 7/24/16: using oasis almost 3 months, thought would add brief comment original review. settled using oasis reading bed, lighter easier hold prefer page turn button style. reading elsewhere, example want read eating, use voyage w/origami case hold upright. read book using kindles since stay synch'd one another, given basically best worlds, least style reading. voyage cover almost seems clunky - bulkier heavier - compared oasis, sitting table hardly matters. say i'm fortunate able afford both, new base model kindle recently picked yet getting much use, even though much reading lighting condition non-illuminated display work fine. original review follows.---------amazon released first kindle november 2007. eight half year later, oasis model 8th generation kindle third evolution kindle built-in illumination. price 300+ bit shock, ordered mine soon announced april 13th.read",Ive loved both my Paperwhite and Voyage is the Oasis worth the additional cost,Phil (not) in Magnolia,1080,1
265,AV1T19MDGV-KLJ3ADSMT,B010EK1GOE,16.0,2.0,"4th kindle since bought first one soon kindle launched. every new model, fascinated improvement kept recommending friends. voyager first time felt somewhat frustrated amazon product.yes, lighter even easier read previous model - buying first one, hesitate - still great product still much comfortable use trying read book ipad - even ipad mini.but... thing thing amazon fix one, specially top line kindle:1. battery cover keep disconnecting reader itself. magnetic attachment strong enough keep position manipulate reader. previous cover stayed place even apple magnetic cover attache better one.2. able turn page button side, able turn page turning screen. way got used handle kindle constantly change hand reading, get lot undesired page turn touched screen somewhere. simple fix could one next software update would greatly improve perception device.3. battery life (even cover) far expected. old kindle battery lasted month, new one need recharging every 15 days.4. device light battery cover cumbersome come simple,e cover protect screen throw bag.5.read",Easy to read and very light but was frustrated with a few things...,Pedro P. Cunha,1059,0
266,AV1T1U7JVKC47QAVGF3J,B00LWHUB9A,599.0,5.0,"new fire hdx 8.9 definitely one powerful tablet, packed pretty nice features. small flaw there, generally around great buy. i'll go i've noticed using tablet, i've learned others using it, well spec feel them. hopefully it'll give insight product help make easier decision whether buy it.*** build quality ***one first thing noticed outstanding build quality. tablet weighs le much competition, provides nice feel due material used making case give nice grip drop tablet easily. everything feel solid... cheap feel android based tablet have. apple still hold title durable case aluminum unless plan throwing thing around, need aluminum... weighs cold!*** snapdragon processor gpu ***this new hdx 8.9 come 2.5ghz snapdragon processor nice gpu going one fastest tablet market moment, fastest. intel nvidia continuously working cpu's tablet chromebook markets, bragging performance blow away competition. acer, example, utilizing nvidia tegra k1 arm based cpu running 2.1ghz quad-core. insanely fast something like chromebook functionality wise, pretty much thing tablet. unfortunately acer, snapdragon cpu fire hdx powerful (2.5 ghz vs. 2.1 ghz) appears using le power.read","EXCELLENT tablet at a reasonable price. The Fire HDX is setting the bar for other tablets! 4,",Liberty Standard,1171,1
267,AV1T1U7JVKC47QAVGF3J,B00LWHUB9A,221.0,3.0,"great device zippy, awesome display, great sound tablet (rivals/bests portable device currently own, including laptops) incredible ease use i'm basically all-in amazon ecosystem. know people lament loss google play, i'm simple guy actually need absolutely everything. watch movies/videos major streaming service use (netflix/prime), music (pandora, spotify, prime), various apps use fantasy sports, reading emails, ebooks (honestly main reason bought thing), reddit. that's le need do, thing beautifully quickly.the reason 3 star because, review, device supremely annoying habit locking up. seems happen often i'm running music program reading browsing attempting shutting off. occurs anywhere three time day, device use i'm traveling around somewhere away home computer, 1-3 time happen inconvenient opportunities.example recent situation: i'm waiting class start i'm hanging college library, listening stuff prime flipping reddit, headphone on. time go in, switch music app shut simultaneously remove headphone put bag. except lock screen stop moving, lose function use it, music keep playing. can't shut off.read","Great product, NEEDS A SOFTWARE UPDATE FOR A VERY ANNOYING PROBLEM. 2,",Christopher Le,1115,0
268,AV1T1U7JVKC47QAVGF3J,B00LWHUB9A,750.0,5.0,"i'm writing review benefit experienced kindle fire user vs. someone brand new kindle family. summary, getting great deal tablet computer - especially compare 500 spend wi-fi version ipad. overall, consider price functionality think great tool / toy watch lot video play lot game device: video quality outstanding. first-time large-screen tablet buyer, price vs. value key consideration comparison expensive versions, i'd recommend it. comparing last year's hdx model version operating fine, i'd say save money continue get money's worth one.my review compare lot feature version fire hdx last year's fire hdx also feature first-time user.consistent experience setup previous model fire, setup took while: despite brand new product, fire attempted download install several operating software updates. need patient downloads installs.screen display / video playback:this version fire best screen display previous model fire looking technical spec amazon made major change display / resolution, picture appears crisp side-by-side comparison last year hdx version ipad air (yes, kindle guy us ipad work): compared viewing experience watching episode lost ship.read","Quality Tablet and Excellent Video / Screen Display 1,",Michael Gallagher,1160,1
269,AV1T19KVGLJLPUI8H8Y-,B00ZS0G0PG,790.0,5.0,"update 7/24/16: using oasis almost 3 months, thought would add brief comment original review. settled using oasis reading bed, lighter easier hold prefer page turn button style. reading elsewhere, example want read eating, use voyage w/origami case hold upright. read book using kindles since stay synch'd one another, given basically best worlds, least style reading. voyage cover almost seems clunky - bulkier heavier - compared oasis, sitting table hardly matters. say i'm fortunate able afford both, new base model kindle recently picked yet getting much use, even though much reading lighting condition non-illuminated display work fine. original review follows.---------amazon released first kindle november 2007. eight half year later, oasis model 8th generation kindle third evolution kindle built-in illumination. price 300+ bit shock, ordered mine soon announced april 13th. spent next two week reading available online describing feature benefit asking whether made right decision. finally released hands, different it, worth appears first high price(my kindle experience: purchased first kindle (a first generation paperwhite), first released sept 2012. purchased voyage first released, sept 2014.read","Ive loved both my Paperwhite and Voyage is the Oasis worth the additional cost 2,",Phil (not) in Magnolia,1213,1
270,AV1T19KVGLJLPUI8H8Y-,B00ZS0G0PG,102.0,5.0,"okay, want read whole review, i'll summarize right here: oasis technologically advanced e-ink reader amazon - anyone else, matter - produced date. worth 290 least expensive version (wi-fi ads) opinion, answer no, capable paperwhite available 100 (at time i'm writing this). i'm sure market oasis, probably techno-geeks gadgeteer like love trying new product like oasis, serious reader want absolute best possible experience reading. typical reader, think oasis add enough reading experience worth high price, especially already paperwhite voyage.for reference, here's brief comparison oasis paperwhite voyage:oasis (2016)-----------------------------size: 5.6x4.8x0.13-0.33 (thickness varies)weight (wi-fi version): 4.6 ounce (without battery case)display: 6 diagonal, 300 pixel per inch, 16-level grayscale, led front-litstorage memory: 4gbpage turns: touchscreen plus page turn buttonsnumber fonts: 9display lighting: manually adjustable front-lighting (10 leds)third generation paperwhite (2015)------------------------------size: 6.7x4.6x0.36weight (wi-fi version): 7.read","A superb e-ink reader, but is it worth the money 1,",J. Chambers,1076,1
271,AV1T19KVGLJLPUI8H8Y-,B00ZS0G0PG,177.0,3.0,"fairly voracious reader - 120+ books/year, almost kindle. purchased every kindle edition soon announced. price bother much, figure much read, make money back buying kindle vs. hardcover book (since mostly read new releases). first kindle sent back though.it's oasis great - is. display slightly crisper previous kindles. set well - button placed well easy use, touch screen work fine. really matter personal preference. love read coffee morning i'm eating lunch work, love origami case voyage has. hard read oasis hands-free, especially used voyage. also, reading laying down, switch hand unconsciously couple time minute. realize used oasis, oasis flip kindle over, may seem like big deal, definitely create seamless reading experience.so like read eating laying probably better using voyage. want best looking read, oasis great. regardless, better reading kindle watching garbage tv!","I sent this one back / And if you eat- or couch-read / The Voyage works best 2,",S. Goldstein,885,0
272,AV1T19KVGLJLPUI8H8Y-,B00ZS0G0PG,323.0,5.0,"owned literally (and mean literally) every kindle since first one. keyboard version followed first one, touch, paperwhite, voyage. fire since first one, different size 10 6 every gen between. (i know, little crazy.) many still use among family member habit switch fire depending mood. last attempt ipad mini, used ereader, first time many year bought book somewhere amazon, found ibooks experience pleasant. bottom line... always seeking kindle fit need book nothing more. stop press. found it.lets put little context around this. eventually migrated fire although liked eink reading, also liked see detail book cover black white seem offer that. paperwhite successor got closer, even without color detail sufficient make browsing cover satisfactory (something always done, even real books).still though, like eink version inability render page without big gap word even truncated line big hyphenated word line. know whether coincidence seen yet oasis, whether amazon ember font help (i like new font lot) whether specifically addressed newer os. whatever, seen yet remove one reason preferring tablet ereader.first impressions... great.read",The best Kindle ever... and I should know I've tried them all.,Lyn Craven,1141,1
273,AV1NIK13-JTXR-F31AFO,B01A08E70K,834.0,5.0,"know many bad reviews. first of, let's start pointing obvious, 100. going receive kindle paperwhite. order, read spec compare kindles. yes, spec say backlighting honestly, one ounce surprise receive this. hand, love little kindle. new kindle paperwhite really like big hold small hands. child hands, i'm female hand small side. maybe male would kind small, idk. anyway, smaller paperwhite, love that. also love fact come light. used read night paperwhite, light gave headache stopped. dark bad review make seem. read perfectly fine indoors. they're exaggerating. feel like book kindle paperwhite ever did. letter kindle amazing. even notice difference ppi love letter way darker paperwhite. paperwhite grey hue feel like reading book. felt like actually holding technical device read book. course since backlight, cannot read dark. common sense. want read night, purchase little book light super inexpensive attach kindle. big deal going break bank buying 119.99 item buy little awesome e-book reader 79.99. think light run expensive e-books...read","LOVE LOVE LOVE!!!!! SO HAPPY!! 1,",MissOliviaP,1048,1
274,AV1NIK13-JTXR-F31AFO,B01A08E70K,74.0,5.0,"read know buying review kindle prior one know going. already new kindle riddled one star review people seem read product description. goes:*this kindle light!*this kindle gaming capability!*this kindle page turning buttons!like regular book might hard time reading kindle bed night low lighting!what get though awesome entry level kindle software almost identical higher end models. print look flawless outside, window, lamp, words, like real book.","Know What You Are Buying!!!!! (redux) 2,",Rustic,448,1
275,AV1NIK13-JTXR-F31AFO,B01A08E70K,11.0,5.0,"sadly lot negative review here, though would add positive one.i second-generation kindle many year ago, since stopped working. finally decided buy new one.i chose basic kindle that's exactly wanted -- bare-bones e-reader. need tablet anything sort. kindle delivers front every way possible.at first, thought would miss page turn buttons, dislike touch screen. however, delightfully surprised. tapping edge screen turn page incredibly easy le intrusive pushing button, always nice little jarring reminder wasn't, fact, reading paperback. small, quick tap thumb edge screen become almost like reflex notice anymore feel natural.i slightly miss metal backing older kindles made feel bit sturdier, whereas basic kindle hard plastic. however, suspect using metal casing would price considerably, feel cheaper price basic kindle far outweighs slight drawback.i bit bullet bought one without special offers. want ad intruding kindle experience, even show screensaver bar across bottom home screen. distasteful me, extra 30 worth avoid ads.i need want case kindle. like read case on, would cumbersome remove kindle case every time want read.read","I love this little e-reader 1,",Sara Krzykowski,1137,1
276,AV1NIK13-JTXR-F31AFO,B01A08E70K,346.0,5.0,people saying dark. literally screen older devices. look comparison. anything new kindle (on right) lighter previous device.,To all the people saying it's too dark. It's ...,Alex,124,1
277,AV1NIK13-JTXR-F31AFO,B01A08E70K,89.0,5.0,"shocked! so, going book phd dissertation, highlighting part citation project. done it, realised instead scrolling back page e-book, looking highlights, export e-mail pdf file. life changing me! always preferred paper book e-books, option miracle. saved hour work! happy customer!",Perfect for academics!,Dina,279,1
278,AV1NIK13-JTXR-F31AFO,B01A08E70K,111.0,5.0,"love new kindle! priced right (with extra 20 off!), even smaller hand kindle keyboard. sad lose old kindle, one terrific.",Love the new Kindle 8!,Linda S Fox,121,1
279,AVPFLDWHLJEJML437ZF,B00PD81ETU,61.0,5.0,"although i've owned almost every model kindle ebook reader since 2nd generation kindle bought 2009, think hard ordering new voyage. happy paperwhite (the 2nd generation released fall 2013), much wanted try voyage, sure wanted spend 199 one. became moot point, though, wife ordered voyage, saying early christmas present me. i've time use voyage, say i'm impressed. hardware feature like 300 ppi display, led automatically adjust screen brightness depending ambient lighting, user's choice touchscreen sensor acting like button turn pages, voyage hand state-of-the-art e-ink ebook reader. end review, i'll give opinion whether worth upgrading current ebook reader.when received voyage, setup quick (although go brief tutorial), downloading book amazon cloud adjusting settings, voyage ready go. here's brief comparison voyage paperwhite:voyage---------size: 6.4x4.5x0.30weight (wi-fi version): 6.3 ouncesdisplay: 6 diagonal, 300 pixel per inch, 16-level grayscale, led frontlitstorage memory: 4gbpage turns: touchscreen plus pagepressdisplay lighting: adaptive light sensor (automatic) plus manual adjustmentpaperwhite-------------size: 6.7x4.6x0.36weight (wi-fi version): 7.read","The state of the art e-ink reader but is it worth the money to upgrade 13,",J. Chambers,1178,1
280,AVPFLDWHLJEJML437ZF,B00PD81ETU,82.0,5.0,"since people gone detail device, answer burning question received mine. happy paperwhite would bought mine stolen/lost (not sure which). husband still paperwhite, able compare side side.can use wall charger paperwhite charge voyageyes.can pressing page turner cause repetitive use issuesi think so. turn pressure need (which slight) turn completely turn page tap. actually nice options.can see turn page darkno. guess page forward area is, page back dot, guessing would difficult. still tap turn pages. using cover helps, edge cover would right dot.does feedback buzz annoy turn pagesi think take little getting used to, turn down, think notice while. (there's sound purely tactile.) month later: distracting forget it.is adjustable light nicei still manually. adjust way i'd like to. bright good light i'd like, dim husband sleeping next me. note want use night light, set separately auto adjust. settings/device options/screen light. i'm actually sure night light working. 18 turned light (this quite bright), checked 10 minute later, 17.read","I was very happy with my Paperwhite and would not have bought this ... 5,",K.E. Fuhrmann,1044,1
281,AVPFLDWHLJEJML437ZF,B00PD81ETU,581.0,3.0,"i've got mixed feeling one, unfortunately. review coming kindle enthusiast owned used nearly every variation device since 1st generation.size weight---it's noticeably smaller lighter paperwhite. saw spec really strike something would make much difference me, real life actually great. voyage fit coat pocket paperwhite little big fit into.origami cover---i know there's separate product page origami cover, worth mentioning official cover. origami cover ugly skeptical, actually love it. weird open flipping top like notepad. actually make comfortable hold cover open, opinion. hard describe, lot way hold voyage attached cover, generally comfortable use. origami part case work great well... stand vertically horizontally (if laying reading, amazing).the great new thing case voyage attache magnetically. attache detaches easily, unlike paperwhite seemed nearly permanently attached standard case. great decide want read device appreciate light/thin without case attached, super easy take out.it's pricey worth it.pagepress---one new feature pagepress, sensor outer edge device squeeze turn pages.read","Almost like Paperwhite v1 all over again 5,",sam,1102,0
282,AV1T1NJGV-KLJ3ADSMC,B06XDD27LJ,190.0,5.0,"updated 6/617 - useful 3 along full sized echo amazon echo - blackafter using full sized echo couple month thought would nice expand one piece hardware. experience 'dot' went ahead shopped refurbished (a first well.) dot arrived small plain box. upon removal found dot look like new. blemishes, scuffs, dings, nothing whatsoever indicate based appearance anything new. come plug, usb charging cable.that said matter functions. concerned refurbished worry worked good new. device work exactly full sized echo. biggest difference addition 3.5mm aux jack. pair larger 'big brother' bluetooth speaker set wired bose headphone needed extra bit could use too.how dot full sized echo compare difference surprisingly few. said dot 3.5mm jack use wired speaker, headphone earbuds echo not. dot listening speech low volume sound good volume level could tell difference either two. however higher volume dot struggle larger echo easily winning out. otherwise appearance function same.as echo smaller version dot doread",Updated 6/6/17 they're great! have several now,Snowmass,1007,1
283,AV1T1NJGV-KLJ3ADSMC,B06XDD27LJ,31.0,5.0,"hesitant purchase refurbished unit, discount time purchase good pas up. fully planning returning slightest sign issue. unit month now, worked perfectly since received it. like brand new unit. get refurb substantial discount, think totally worth risk buying new unit.edit (07/08/2017): original refurb'ed echo dot still going strong, received second refurb'ed echo dot yesterday. second one like new first one. packaging similarly like new. clear sticker cover surrounding like new unit, believe power adapter, cable, manual actually brand new.",My refurb is like new. I love the Echo Dots!,Robert Beeman,543,1
284,AV1T1NJGV-KLJ3ADSMC,B06XDD27LJ,172.0,5.0,"birthday gift daughter. (71st birthday--certified old guy) might echo bought 3 kindle book using echo. later discovered book probably board helps, book make nice linear presentation make guess need search out, kindle book make easy make note find later ease.i using echo primarily radio. early 1990s worked german skill listening lot shortwave radio. internet. could listen smart phone, us phone battery reserves. echo run ac power wall outlet. little speaker adequate voice broadcasts. listen hour german news magazines. also listen old favorite broadcast radio canada.we live favorite talk radio program come poorly due another station near dial. but, wifi reach garage workshop clear audio tune in. (i trouble linking iheart radio, perhaps subscription paid.)when asked alexa question sometimes tell cannot answer question thought simple enough.i ask music surprised find cd bought gift amazon's cloud hear echo. nice!",Some nice surprises,Philip J. Bohlken,921,1
285,AV1T1NJGV-KLJ3ADSMC,B06XDD27LJ,27.0,4.0,"everything work pretty great, always catch say.. definitely worth purchase. pleased.",Worth it.,Amazon Customer,84,1
286,AV1T1NJGV-KLJ3ADSMC,B06XDD27LJ,5.0,5.0,"i'm totally enjoying echo dot! synced google calendar able let alexa tell what's agenda day. quickly ask set timer alarm easily find local weather. also synced pandora account specific saved station name want listen pandora. really wish could say shuffle pandora stations. would awesome! speaker dot loud would like i'm sitting close by, good enough guess. i've seen option add external speaker gotten around yet. 6 yo grandson love ask tell joke! live small town probably able utilize full potential alexa i'm regretting purchase.",Great little assistant,Marianne Rattan,531,1
287,AV1T1NJGV-KLJ3ADSMC,B06XDD27LJ,7.0,5.0,nice compliment echo. connected bt speaker actually step le expensive echo. i'd bought 2 dot instead.,This is a nice compliment to my echo,mark d.,101,1
454,AVSRJFWAU2QCYX9PHQE,B01J2G4VBG,3.0,4.0,"according info, paperwhite charge faster charger made kindle think brand work. came package deal bought paperwhite otherwise would've skipped used i've using old kindle. gave 4 stars, like it, feel overpriced.","because I like it, but feel it's overpriced",Grandmaof4,209,1
455,AVSRJFWAU2QCYX9PHQE,B01J2G4VBG,3.0,5.0,charger worked well charging voyage. come separate purchase voyage found. think bundledwith purchase price kindle voyage.,Charger has worked well for charging my Voyage. Comes ...,C G,121,1
456,AVSRJFWAU2QCYX9PHQE,B01J2G4VBG,9.0,5.0,i'm glad made purchase. often bring computer travel. enjoy option using standard outlet charge paperwhite.,I'm very glad that I made this purchase,Leslie Kennedy,106,1
457,AVSRJFWAU2QCYX9PHQE,B01J2G4VBG,2.0,2.0,overpriced!,Two Stars,Len Burroughs,11,0
459,AVSRJFWAU2QCYX9PHQE,B01J2G4VBG,2.0,5.0,first rate - high quality!,First rate - high quality!!,The Old Dog,26,1
461,AVSRJFWAU2QCYX9PHQE,B01J2G4VBG,3.0,2.0,,Two Stars,Joe Ventresco,0,0
462,AVSRJFWAU2QCYX9PHQE,B01J2G4VBG,4.0,5.0,"work great, expected. kindle need charge often, use time phone. nice charger one room.",Hard to go wrong with a wall charger purchase,Steven Moren,86,1
463,AVSRJFWAU2QCYX9PHQE,B01J2G4VBG,6.0,1.0,"third power charger buy cost 30 since kindle fire purchase. can't charger last reasonable amount time connected charger, received message saying low level charger probably would charge kindle use. acceptable cost!!!",Only lasts for less than 1 year!,Marilyn Holcomb,215,0
464,AVSRJFWAU2QCYX9PHQE,B01J2G4VBG,19.0,4.0,"expensive charger. think kindle come tablets, including fire, way cheaper includes charger 50. pretty large charger though fit kindle box kindle, all.",It is a pretty large charger though and doesn't fit in the kindle ...,Maureen Clement,150,1
465,AVSRJFWAU2QCYX9PHQE,B01J2G4VBG,16.0,5.0,meet need feel supplied actually purchasing oasis e-reader.,Five Stars,Amazon Customer,59,1
466,AVSRJFWAU2QCYX9PHQE,B01J2G4VBG,7.0,3.0,"find better cheaper version bought initially staples. charge faster fast kindle charger used couple year finally gave out. also, possible charge still use kindle, something able previous charger, feature really miss. still, better alternative.",Adequate,Angela Thoburn,243,0
467,AVSRJFWAU2QCYX9PHQE,B01J2G4VBG,35.0,2.0,q: what's difference 19.99 amazon 5w usb official oem charger power supply 5.95 5v 1a (1000ma) usb port power supply - ul listeda: 14.04 calling 5w charger rather 5v 1a charger distinction without difference.,5W or 5V 1A,G. Bruce White,208,0
468,AVSRJFWAU2QCYX9PHQE,B01J2G4VBG,2.0,5.0,"great. second paperwhite second charger. thinking third, fourth...because putting fiction one non-fiction thinking great kindle dedicated recipes, another health book etc would marvelous",Must have!,Mom goes to school,186,1
