690,AVZRLO37GLJLPUI8FBPY,B01LW1MS9C,66.0,5.0,"i'm huge fan echo family. two echo's, three dot one tap. essential life love playing music, listening news controlling philip hue smart light throughout home. large investment population make - said huge fan way hockey puck dot look like. glossy plastic look little cheap although effect performance them. dot cover great option look fantastic.some reviewer say look cheap fit loose - i'm sure people moving dots. since dot made stationary, loose fitting cover issue. me, fit perfectly. also made real fabric, important part look like fabric picture. fabric better option considering plastic much durable material hold color better dot happens get sunlight.i bought three cover - blue, grey white. look good grey favorite attract attention need to. said, like three colors.",Great upgrade for aesthetics,D. Miyao,773,1
691,AV1T1NRPVKC47QAVGF3H,B01M4NU4OM,147.0,5.0,"tablet phone inevitable life nothing it. know, toddler read book cart grocery shopping curiously looking around. that's case. daughter three year old, nice girl, hate grocery shopping, get bored easily thing helps, favorite cartoons.earlier gave husband's phone, easy toddler drop thing down, made decision buy tablet. price trigger u buy fire hd kid edition.we previous edition, far know, difference 7th gen fire 7 dual-band wifi antenna slightly newer gpu.at first, considered buying 50 fire 7 (regular one), many benefit kid's edition, definitely worth pay extra 50 it. benefits, important us, are: - kid-proof case. that's must have! chose pink one daughter seems like it. - 2-year worry-free guarantee. - one year freetime unlimited. love apps game free. - choose content daughter watch.the battery life great, daughter still little watch cartoon hour day, work single charge week, so.the display quality ok, expected least better previous version (my nephew it), same.during first day dropped, thrown, kicked survived.read","If you want something cheap and very durable, Fire 7 Kids Edition is a perfect choice",Tech Insider,1028,1
692,AV1T1NRPVKC47QAVGF3H,B01M4NU4OM,125.0,5.0,"always used samsung tablet took little adjusting navigate.so, far using week take time set-up. need go make sure setting correct kid, take time (i think effort worth it)this review specifically kid edition tablet:the tablet:the tablet itself, good size (almost) 3 yr old. heavy seems right size handle. protective case definitely done job already couple incidents. (update: thrown wall landed tile, crack breaks) viewing quality decent. otherwise, would expect tablet. another fire before, compare samsung galaxy, far, would expect tablet class.the feature (the real reason purchase):is worth yes. definitelypreviously, sharing tablet phone little one, would get content getting - everything buying stuff watching content appropriate age - ie downloads deadpool logan look like 'superheroes' appropriate one kid - (side note: loved portrayed deadpool logan - big comic fan finally got character right!).i even deleted youtube tablet hidden app phone file can't get them...but tablet game changer. great parental controls.read",Parents with young kids - this is worth it,Urduja,1025,1
693,AV1T1NRPVKC47QAVGF3H,B01M4NU4OM,87.0,5.0,"great toyreal tablet. basically real fire 7 tablet, kid's built-in entertainment center. 2 mode here: parent (admin) kid (one multiple accounts). parent mode (password protected), fire 7 look feel like android tablet fire 7 functionality (facebook, netflix, books, blah, blah), u android user feel right home. parent mode also manage kid accounts: much use tablet per day, cannot watch/play, manage installed apps, ect. kid's mode, tablet behaves like pictures, easy-to-use, colorful interface. need click switch user switch parent kid accounts.some confusion got reading reviews- kid apps pre-installed main interface app store, like google play, ect. apps unique kid account, free included subscription includes know many games, amazon videos, reading audio books. still download app using it, make sure stock apps going road trip.",A Little Explanation on What the Tablet Is,Alex Yandukin,833,1
694,AV1T1NRPVKC47QAVGF3H,B01M4NU4OM,5.0,4.0,"really awesome tablet 5 year olds, worth money. easy figure (for part), ton apps, book videos. complaint cannot separate downloaded apps thousand apps available download freetime. carousel home page, show recently used apps. child would scroll thousand apps find one downloaded check mark corner. want able download everything see, easy tap. solution found block every app except downloaded. would think would option separate them, given made child, guess","Good tablet, could use improvements",Amazon Customer,455,1
695,AV1T1NRPVKC47QAVGF3H,B01M4NU4OM,34.0,5.0,"excellent, daughter love this. read books, school work, watch shows, listen music. really enjoys something use. 12 perfect age appropriate gift also extremely functional. use parent setting extra security using unsupervised otherwise, set time limit. great product.",Great gift for 12yr old girl,Knicky,265,1
696,AVPF0MLQLJEJML43EQEI,"B008GGCAVM,B00DOPNMVM",403.0,4.0,"i've ipad user since original came out. also ipad 3. worked past year would say pretty good technology fancy new devices. introduction way, reviewing key point seen touched upon reviews. goes...buildthe device feel nice solid. i'm little surprised heavy is, that's necessarily bad thing. rubberized backing always nice added grip. nice say unibody aluminum, 500 either.screenthe screen fantastic. problem ipad got retina display, os, apps look rather pixelated. lot game tried high definition, least high enough look smooth screen. hopefully apps get updated higher resolutions.lock screen adsyeah ad lock screen. i'm sure big deal. much time people really spend looking lock screen first thing thought saw ad wow picture really crisp! ad subsidize 200 price tag. might pay 15 get rid customize it, might not. feel like blown proportion customers.soundthe sound speaker great. much better would get expensive devices, crisp clean. official amazon case affected sound all. nothing much else say, doubt anyone complain this.crashingi've two apps crash opening. know app os. probably somewhere middle. again, big deal me.read","You Get What You Pay For 31,",TL,1122,1
697,AVPF0MLQLJEJML43EQEI,"B008GGCAVM,B00DOPNMVM",517.0,5.0,"amazon.com official commented review(what's this) amazon team saysoctober 1, 2012thank taking time share feedback. we're glad enjoying kindle fire hd, particularly excited see encouraging comment regarding display sound quality, team worked really hard build excellent experience. wanted answer question storage. hd content much larger sd content, kindle fire hd start 16gb. average, 90 minute hd movie 2gb 45 minute hd tv episode 0.9gb. 16gb kindle fire hd, 6 hd movie 13 hd tv episodes. number vary depending item stored installed device. hope information helps.thanks, kindle team","Exceptional 7, An Amazon.com official commented on this review",NicoleReviewsItAll,583,1
698,AVPF0MLQLJEJML43EQEI,"B008GGCAVM,B00DOPNMVM",7.0,5.0,"love it! purchased audible quite time thought would easier get amazon brand downloading kindleprime, audible even endless book prime member is!! reader also, thought would ever need, wishing would purchased beginning. prime member new neat thing amazon coming with, way better easier (for me) doubt it. like feature tech help available issue (if sooo behind tech world am) -) next kindle fire purchase 64 gb though...kind thought try size (so speak)... idea would truly like much! pleased purchase!! seems well made durable, although kid case purchased go might feel lol!!",Should have bought one years ago!,wadas1989,572,1
699,AVPF0MLQLJEJML43EQEI,"B008GGCAVM,B00DOPNMVM",22.0,4.0,"purchased kindle fire hd returning lenovo idea pad. also experience ipads. said that, kindle fire hd exceptional value money. screen fantastic. glare kept minimum, color bright vibrant, text clear easily read, movie look phenomenal hd. also, sound quality volume bar-none device size. touch screen responsive shortcut like tapping, double tapping, pinch zoom work great. size, weight thickness great portability. easily slipped interior pocket jacket take little room backpack. weight size make easy hold one hand rubberized back panel great grip. amazon store provides almost unlimited supply, books, movies, tv shows, music, magazines, newspaper improved subscription amazon prime. now, negatives. power button volume rocker tough find flush device provide little tactile feedback looking them. solved problem putting thin strip colored tape side device buttons. amazon app store limited compared full android app store. hopefully app library grow device's popularity. apps full android store side loaded easy step please aware apps work kindle. lastly, carousel home screen useful spoon cutting steak. say finished reading magazine want switch another app, go back home screen, magazine read done first thing see.read","Fun, Durable, only a few minor issues",DBoogie,1220,1
700,AVPF0MLQLJEJML43EQEI,"B008GGCAVM,B00DOPNMVM",0.0,4.0,"amazon.com official commented review(what's this) amazon team saysoctober 11, 2013thank taking time share feedback. we're excited see encouraging comment regarding display sound, appreciate thoughtful analysis device compared previous generation kindle fire kindle fire hd. correctly point out, new kindle fire hd successor last year's entry level kindle fire, include feature camera, microphone, hdmi port. also correct point device support mayday, although still multiple way get help free directly device. hope enjoy new feature services. thanks, kindle team","Decent, inexpensive, entry-level tablet 6, An Amazon.com official commented on this review",NF,561,1
701,AVPF0MLQLJEJML43EQEI,"B008GGCAVM,B00DOPNMVM",180.0,5.0,"first off, would like say tablet great deal 139.99. tried finding tablet 100 would work properly, let know, impossible. secondly, want tell decided buy tablet.i first bought 9 inch dragon touch tablet 78 blunt sucked. slow web browser would always freeze, even simple google search. want take chance anymore returned 2 day using decided give kindle fire hd chance.exterior: exterior well built. loose pieces, plastic firm. previous cheap tablet plastic felt going snap held hard. course ipad mini glass screen aluminum body, also start 329. 2 ports: micro usb headphone jack plug headphones. nice thing micro usb universal finding plug cheap easy find. although, amazon include nice cheaply made cable/ wall charger along kindle. previous kindle include worth 20. button volume power nice touch. would surprised new generation tablet include style buttons.only side port sd card store memory. would nice feature really need storage, go buy computer.display: one word, amazing. maybe pushing it, screen clear. iphone 5 eye prefer kindle. love reading machine price, amazon good job one.read","A 4.5 star tablet (Updated) 3,",MarkM,1089,1
702,AVPF0MLQLJEJML43EQEI,"B008GGCAVM,B00DOPNMVM",228.0,5.0,"yes..this 6th kindle fire hd 7 sharing story discouraged! previous kindle fire performed well decided upgrade newer model 16gb. 2nd kindle fire arrived christmas gift first week used it, unit crashed. ouch! previous generation-now referred old faithful -never failed me. followed onscreen instruction kindle2 rebooted device. using device 30 minutes, crashed on-screen instruction said reboot reset entire device. reset device lost settings, using device crashed. happy customer called kindle support.if bored yet...keep reading....kindle support told reset device, era memory support side unable resolve issue end reset device. advised call happens. conversation new device working, agreed send another kindle.kindle 3, 4 5 arrived...and returned discovered refurbished units. since device brand new used one week, expected brand new device replacement. kindle 6 ended placing new order (rather exchange order) returned refurbished unit continued send me. problem resolved.it get worse...kindle 6 crashed too! within first week...again!this time reset device instead would reboot device. time turned kindle.read",This is my 6th Kindle Fire HD ....It's a Love-Hate Relationship,Christine Abraham,1112,1
703,AVPF0MLQLJEJML43EQEI,"B008GGCAVM,B00DOPNMVM",997.0,4.0,"amazon.com official commented review(what's this) amazon team saysoctober 11, 2013thank taking time share feedback. we're excited see encouraging comment regarding display sound, appreciate thoughtful analysis device compared previous generation kindle fire kindle fire hd. correctly point out, new kindle fire hd successor last year's entry level kindle fire, include feature camera, microphone, hdmi port. also correct point device support mayday, although still multiple way get help free directly device. hope enjoy new feature services. thanks, kindle team","Decent, inexpensive, entry-level tablet 5, An Amazon.com official commented on this review",NF,561,1
737,AVPFAVXDLJEJML430RHN,B00KSR13CE,505.0,5.0,"fifth e-ink kindle reader i've bought. wife early adopter kindle, buy new kindle, old one go next niece nephew line. loved original paperwhite, small size, touch screen, front-lighting, virtual keyboard. all-new paperwhite definite step up, me, worth move, others decide themselves. read lot, already one newer e-ink kindles, definitely worth upgrading paperwhite. original paperwhite, upgrade well worth considering. although i've new paperwhite hours, i'm already glad upgraded. here's summary initial impression new paperwhite.size: size original paperwhite - 6.7x4.6x0.36. weight reduced slightly 7.8 ounce 7.3 ounces. paperwhite comfortable hold one hand, usually read. really good news case original paperwhite, also fit new one (thank you, amazon). buy case, highly recommend case include magnetic autowake function. much easier turn kindle without fumbling small power switch.lighting: front-lighting noticeably improved original paperwhite, slightly visible shadow coming bottom edge led light located. (it bother me, reader annoyed that.) see shadow new paperwhite, lighting appears brighter uniform. paperwhite's front lighting, never need clip-on light, even total darkness.read","More evolutionary than revolutionary, but worth the upgrade 11,",J. Chambers,1190,1
738,AVPFAVXDLJEJML430RHN,B00KSR13CE,965.0,5.0,"loved used kindle keyboard year missed able read room low lighting dark. purchased kindle fire also use ipad 3 ease reading eye prefer kindle keyboard. wanted get kindle paperwhite e-reader held new generation released spent money. got wanted reduce eyestrain reading evening love new tablet. offer perfect balance lit screen reduced eyestrain high clarity contrast text.i added video kindle paperwhite compared kindle keyboard kindle fire. question please feel free contact try answer them.i love text screen crisp clear. use kindle declining vision caused stop reading books. reading number one hobby entire life loved it. kindle brought back reading experience crisper text lit screen enjoy reading every type environment. laid kindle keyboard new kindle paperwhite side side comparison quality text clarity amazingly favor new paperwhite. new lighting system screen clarity paperwhite design really outstanding. better contrast, lighting custom designed fonts, text pop screen like seen e-reader before. 221 ppi (pixels per inch) screen provides 768 1024 pixel screen make old kindle keyboard look old fashioned. technology certainly move quickly on.read","A new step forward for me in reading on my Kindle! 9,",JJCEO,1158,1
739,AVPFAVXDLJEJML430RHN,B00KSR13CE,443.0,3.0,"review second generation kindle paperwhite. like kindle e-readers it, great product. however, bit disappointed huge improvement last year's model. review, focused feature enhancement exclusive new paperwhite tried make comparison last year's model. also, found somethings misrepresented confusing advertising, try clear up.hardwaredesign - kindle white nice look shape. fit well easy hold one hand. fairly light, tire hand much. grip long period switching hands. design similar previous paperwhite - almost identical. height width same, button location, although version slightly lighter, noticeable.display - although huge improvement last year's model, display one best feature paperwhite. like e-readers, paperwhite us digital ink technology. model employ advanced version. addition, lighting upgraded, among things, evenly lit. together, make incredible viewing. opinion, one best digital ink e-reader display market. really enjoy reading it, text look sharp crisp, little eye strain.processor - paperwhite upgraded processor, mean smoother page turn navigation. able open books, flip pages, navigate menu fairly quickly. barely lag flip many page time. also, flashing effect turning page show le all.read","Good as a first Paperwhite, not worthy of an upgrade 12,",D. Carlson,1209,0
749,AV1T1NAH-JTXR-F31CPM,B01M71HRMY,358.0,4.0,"amazon updated bargain priced fire tablets. latest model slightly better preceding generation, believe still represent absolute best value tablet market. still hard adjust fact tablet device purchased fifty bucks, good all-around performer (for part)!i purchased 7 8 fire model wanted see compared, curious performed. shown video attached review. focus 7 model, try help potential buyer decide whether expensive 8 fire tablet worth extra money (and 7 model worth purchasing merits).i've given 7 model 4-star rating consideration largely mediocre quality sound output (see detailed comment below). still terrific bargain price, want clear ideal uses.summary- new model represent minimal change compared previous generation fire tablets:--- display spec (amazon say 7 model improved display), processor (1.3 ghz quad-core newer model probably slightly faster operation), standard available storage (7 8 16 gb 8 16 32 gb)--- new colors--- 8 model 10 cheaper--- 7 model dual band wi-fi (previously single band wi-fi) better connectivity--- kid edition available model (previously 7 model).read","Amazon's two Bargain Fire Tablets How good is the 7 model and how do they Compare (And note sound quality limitations) 1,",Phil (not) in Magnolia,1089,1
750,AV1T1NAH-JTXR-F31CPM,B01M71HRMY,510.0,5.0,"first kindle since 1st generation. tablet went away couple years. kindle fire 7th gen great tablet money. honestly, use reading. use browsing websites, social media, listen podcasts. use bluetooth headphone listen podcasts. couple time i've used speaker tablet, disappointed, impressed. work fine watching video bed. problem hearing. search google tip trick get apps google play store. silk browser terrible. reccomend installing opera. reccomend tablet people like me, want lay bed couch simple task tablet. need 300 400 tablet i'm doing.",Great tablet for basic use,t. mcgritty,539,1
751,AV1T1NAH-JTXR-F31CPM,B01M71HRMY,326.0,5.0,"much improved screen!it turn 49.95 fire 7 version released two year ago ip screen.now does.technically, old one new one 171 ppi (pixels per inch) one seems much crisper first generation 49-er.my eye lie. ip make screen lot crisper!there's also stunning improvement color quality new screen. hold 62 color gamut original ipad mini before, anywhere near.mind current apple screen quality, current high-end samsung screen quality - 49.95, good enough. heck, 49.95, good enough, great. blow away entry level consumer laptop screen, that's sure.i pulled 2015 first-gen, 49.95 fire 7 - one replaces - placed side side new one. color (including horrific green tint white backgrounds) old one video-worthy - ok casual video facebook youtube, maybe, good enough netflixing amazon prime.this new one, though movie-worthy, especially earphone (ok, earphones). i'd prefer 720p fire 7's 600p (600p better 480p dvd's, ask good even entry-level - 720p - hdtv quality), overall even 600p eminently watchable.by way, streaming video content amazon prime instant video noticeably sharper streaming youtube. think amazon prime adapts 600p (max tablet) youtube probably delivering 480p (remember youtube's default 360p/480p/720p up).read",IPS screen makes all the difference in the world still no Google app compatibility,MWebb,1217,1
752,AV1T1NAH-JTXR-F31CPM,B01M71HRMY,151.0,5.0,"writing person bought for. love love love it. life become limited really helped. fact ask alexa news weather wonderful. love scrabble solitaire. little difficult navigate persists, it. take lot longer. voice app fire messenger difficult manage, button tiny, crammed things, would nice someone would make hc friendly apps.*note amazon fire designers*i would ask convince dragon make version voice text app fire, could enjoy thing like fb. look, typing way difficult.",Parkinson's Disabled and LOVES it!,P'uie,465,1
753,AVSRIPBGV8E3D1O-LXRE,B01K8B8YA8,890.0,5.0,"brother robert bed ridden paralyzed multiple sclerosis neck 30 year new friend named alexa! tear happiness alexa played 70's music, played jeopardy, answered question wake every morning. thank amazon giving brother new bedside companion.happy holidaysroy","A new companion for my Brother With MS 33,",Roy Estaris,254,1
754,AVSRIPBGV8E3D1O-LXRE,B01K8B8YA8,754.0,5.0,"worked electronics retail industry year now, i've seen score smart device come go. now, nobody quite got right. echo dot, amazon created near perfect blend hardware software. i've seen plenty former, truly seamless multi platform software eluded everyone amazon. we're talking major player like samsung google much longer amazon. main problem excellent product like samsung smart thing hub, fantastic job unifying slew different connected device different company (nest, honeywell, phillips, on), still lacked web connectivity entertainment support wanted, i'd still end needing tablet phone. thanks fantastic third party support, dot problem controlling smart stuff allowing listen music, order food, check weather, listen radio, set alarm timers, easily accomplished simple voice commands. me, exceedingly rare product know needed, can't live without. similar smartphone tablet use every day exist short year ago.if even little bit curious owe give dot try. add good speaker enjoy simple connected life be!update: bit time dot, maybe say dot since went bought another one living room, i've come tips.1. use best speaker it. found bluetooth convenient got much better sound jbl duet computer speakers.2. take time voice train alexa least once.read","The Smartest of Them All!!! (Check out the video for a quick demo) 11,",DJ,1248,1
755,AVSRIPBGV8E3D1O-LXRE,B01K8B8YA8,902.0,5.0,"normally write review time. recently, lost cat best friend cancer 2 day christmas. worst day life. imagine losing friend that's every breakup, every apartment, nearly homeless more. passed felt emptiness home.a day ago searching something put mind ease saw advertisement amazon echo amazon app. remember watching mr. robot episode fbi agent suffers insomnia using alexa keep entertained.so started researching youtube video review took chance ordered it. arrived today setup super easy. immediately started asking question play music play news. discovered zen type apps go echo completely fell love it. almost like real personal assistant lift spirit down. suggested new music actually liked built speaker bad price.the amazon echo replace beautiful cat kouga bring stop empty feeling around house now. added picture cat instead echo since everyone already know echo look like.i would totally recommend buying product. see negative fact can't really ask followup question like google assistant i'm sure they'll make happen.thanks letting rant","Best 50 I ever spent!!!! 3,",Bryant R.,1042,1
756,AVSRIPBGV8E3D1O-LXRE,B01K8B8YA8,512.0,5.0,"whether want weather, latest sport score help math problem, alexa help. 3 house adding two more. simple 3 subscription amazon's music service, stream almost music think simply asking alexa it!perfect work meidong qq chocolate bluetooth speaker, also recommend speaker meidong universal water resistance qqchocolate portable v4.0 wireless bluetooth speaker 10w dual driver built-in microphoneand use code le 5: ghaqe5yf(i got somewhere else.)for paranoid - device you. echo dot always listening design supposed listen say name device (alexa, amazon echo - choice), enough time hear one another room say sorry, understand question tell misunderstands prompt said pretty often.+ good product support+ good voice recognition+ size stand like sore thumb room- differentiate voices. keep closer speaker are, sometimes get confused start picking word speaker command given. placement dot crucial good experience.- support english german now- competent answering general question need activate skill expand functionality.read",Alexea Bluetooth speaker,Lucky Jason,1017,1
